{
  "schema": "tbg.workflow-contract.v1",
  "id": "project-ai-layer",
  "sprint": "037F",
  "contextBanner": "[TBG | Sprint 037F | Project AI Layer Execution | branch: sprint/037a-local-agent-harness]",
  "purpose": "Execute the AI Layer plan by adding CLAUDE.md hierarchy, path-scoped skills, subagent contracts, and reviewable self-improvement hooks.",
  "scope": {
    "allowed": [
      "CLAUDE.md hierarchy",
      "path-scoped skill catalog",
      "subagent summary schema",
      "agent prompts",
      "stop-hook proposal script",
      "docs and handoff updates"
    ],
    "forbidden": [
      "launch Bannerlord",
      "run ForgeReboot",
      "click launcher",
      "write command inbox",
      "mutate saves",
      "modify gameplay behavior",
      "silently rewrite CLAUDE.md from a stop hook"
    ]
  },
  "requiredArtifacts": [
    "CLAUDE.md",
    ".tbg/harness/skills/path-scoped-skills.catalog.json",
    ".tbg/harness/schemas/subagent-summary.schema.json",
    ".tbg/harness/prompts/tbg-exploration-subagent.md",
    "scripts/harness/Write-TbgClaudeRulesProposal.ps1"
  ],
  "validationCommands": [
    "powershell -ExecutionPolicy Bypass -File scripts\\harness\\Test-TbgHarnessReadiness.ps1 -ContractId \"project-ai-layer\"",
    "powershell -ExecutionPolicy Bypass -File scripts\\harness\\Test-TbgCommandSafety.ps1 -CommandText \"ForgeReboot.cmd\" -ContractId \"project-ai-layer\"",
    "powershell -ExecutionPolicy Bypass -File scripts\\harness\\Write-TbgClaudeRulesProposal.ps1 -ContractId \"project-ai-layer\"",
    "git diff --check",
    "git status --short"
  ],
  "terminalStates": [
    "ready",
    "missing_prereqs",
    "blocked_by_policy",
    "repo_invalid"
  ]
}
